Goodman, MS:
This Afternoon, 2024-06-30T13:00:00-05:00, 95, Chance Showers And Thunderstorms
Tonight, 2024-06-30T18:00:00-05:00, 73, Chance Showers And Thunderstorms then Partly Cloudy
Monday, 2024-07-01T06:00:00-05:00, 91, Mostly Sunny
Monday Night, 2024-07-01T18:00:00-05:00, 67, Mostly Clear
Tuesday, 2024-07-02T06:00:00-05:00, 96, Sunny
Tuesday Night, 2024-07-02T18:00:00-05:00, 75, Mostly Clear
Wednesday, 2024-07-03T06:00:00-05:00, 95, Sunny then Slight Chance Showers And Thunderstorms
Wednesday Night, 2024-07-03T18:00:00-05:00, 75, Slight Chance Showers And Thunderstorms then Partly Cloudy
Independence Day, 2024-07-04T06:00:00-05:00, 95, Sunny then Scattered Showers And Thunderstorms
Thursday Night, 2024-07-04T18:00:00-05:00, 76, Scattered Showers And Thunderstorms then Mostly Clear
Friday, 2024-07-05T06:00:00-05:00, 95, Isolated Rain Showers then Scattered Showers And Thunderstorms
Friday Night, 2024-07-05T18:00:00-05:00, 75, Scattered Showers And Thunderstorms
Saturday, 2024-07-06T06:00:00-05:00, 93, Scattered Showers And Thunderstorms
Saturday Night, 2024-07-06T18:00:00-05:00, 73, Scattered Showers And Thunderstorms
